{
  "$schema": "https://json-schema.org/draft/2020-12/schema",
  "$id": "https://specs.hara-lang.io/schemas/hara-spec-package.schema.json",
  "title": "Hara specification package manifest",
  "type": "object",
  "required": ["name", "version", "kind", "entry", "accepts"],
  "properties": {
    "name": {
      "type": "string",
      "pattern": "^@[a-z0-9][a-z0-9._-]*/[a-z0-9][a-z0-9._-]*$"
    },
    "version": {
      "type": "string",
      "pattern": "^(0|[1-9][0-9]*)\\.(0|[1-9][0-9]*)\\.(0|[1-9][0-9]*)(?:-[0-9A-Za-z.-]+)?(?:\\+[0-9A-Za-z.-]+)?$"
    },
    "kind": {
      "enum": ["hara/spec", "hara/profile", "hara/rules", "hara/adapter", "hara/dataset"]
    },
    "entry": {
      "type": "string",
      "pattern": "\\.hal$"
    },
    "accepts": {
      "type": "array",
      "minItems": 1,
      "items": { "type": "string" },
      "uniqueItems": true
    },
    "description": { "type": "string" },
    "license": { "type": "string" },
    "profiles": {
      "type": "array",
      "items": { "type": "string" },
      "uniqueItems": true
    },
    "capabilities": {
      "type": "array",
      "items": { "type": "string" },
      "uniqueItems": true
    },
    "dependencies": {
      "type": "object",
      "additionalProperties": { "type": "string" }
    }
  },
  "additionalProperties": true
}
